{
  "schema_version": "prodocux_filesystem_sink_record_v1",
  "record_status": "created",
  "output_name": "summary.pdf",
  "artifact_id": "artifact-example-1",
  "uri": "artifact://sink/summary.pdf",
  "sha256": "ca978112ca1bbdcafac231b39a23dc4da786eff8147c4e72b9807785afee48bb",
  "size_bytes": 128,
  "media_type": "application/pdf",
  "idempotency_key": "request-example-1:render",
  "mount": "output"
}
